{
 "meta": {
  "schema": "optiondesk/simulation/v1",
  "generated_utc": "2026-09-08T22:15:42+00:00",
  "tool": "optiondesk simulate",
  "shell_version": "0.3.0",
  "engine_version": "0.3.0",
  "provider_used": "synthetic teaching sample",
  "degraded": false,
  "degraded_reason": null,
  "notes": [
   "Synthetic teaching inputs. No observed quotes, holdings, or price history. Not market-performance evidence.",
   "structure probabilities are computed from realised volatility and will differ from the implied-volatility figures on the plans themselves"
  ],
  "inputs": {
   "symbol": "SYNTH",
   "horizon": 30,
   "paths": 10000,
   "draws": 3000,
   "chains": 2,
   "period": "2y"
  },
  "disclaimer": "Research output, not investment advice, and not a recommendation or solicitation. Option premiums here are theoretical model values, not quotes and not achievable fills. Market data is third-party, may be delayed or wrong, and its redistribution is governed by the provider's terms. No warranty. See DISCLAIMER.md.",
  "license": "Produced by optiondesk under the PolyForm Noncommercial License 1.0.0. Noncommercial use is permitted; commercial use requires a separate written agreement with the copyright holder. See LICENSE and LICENSES.md."
 },
 "underlying": "SYNTH",
 "spot": 100.0,
 "history": {
  "observations": 756,
  "first": "2023-10-16",
  "last": "2026-09-08",
  "period": "synthetic",
  "annualised_volatility": 0.21866296387066242
 },
 "posterior": {
  "converged": true,
  "model": "GARCH(1,1) with standardised Student-t innovations, sampled by adaptive random-walk Metropolis",
  "parameters": {
   "mu": {
    "mean": 0.0003802461747011738,
    "p5": -0.0004106561301915417,
    "p50": 0.0003620934644026762,
    "p95": 0.001187175022208295,
    "rhat": 1.0066100596100256,
    "ess": 533.681073710941
   },
   "omega": {
    "mean": 7.406342669630788e-05,
    "p5": 9.30294133904546e-06,
    "p50": 6.682185818437858e-05,
    "p95": 0.00015725937588137757,
    "rhat": 1.0065373103208126,
    "ess": 172.10700643060193
   },
   "alpha": {
    "mean": 0.028214116062342455,
    "p5": 0.0031360327552568566,
    "p50": 0.019122512044954396,
    "p95": 0.08368992901633543,
    "rhat": 1.0027231774354075,
    "ess": 423.17580525928423
   },
   "beta": {
    "mean": 0.5882522808349193,
    "p5": 0.14477758841606306,
    "p50": 0.6202526528722694,
    "p95": 0.9408207907733999,
    "rhat": 1.0067035583680954,
    "ess": 160.1678596875188
   },
   "nu": {
    "mean": 28.90412546331153,
    "p5": 12.378883913826792,
    "p50": 23.529252517472973,
    "p95": 62.45367432613702,
    "rhat": 1.0008922438757955,
    "ess": 513.8122406546667
   }
  },
  "diagnostics": {
   "chains": 2,
   "draws_per_chain": 3000,
   "burn_in": 1000,
   "acceptance_rate": 0.3164666666666667,
   "acceptance_rate_including_burn_in": 0.3358,
   "rhat": {
    "mu": 1.0066100596100256,
    "omega": 1.0065373103208126,
    "alpha": 1.0027231774354075,
    "beta": 1.0067035583680954,
    "nu": 1.0008922438757955
   },
   "ess": {
    "mu": 533.681073710941,
    "omega": 172.10700643060193,
    "alpha": 423.17580525928423,
    "beta": 160.1678596875188,
    "nu": 513.8122406546667
   },
   "converged": true,
   "rhat_limit": 1.05,
   "min_ess": 100,
   "note": "Split R-hat above 1.05 or effective sample size below 100 on any parameter means the chains have not agreed and the quantiles should not be quoted. A zero acceptance rate means the sampler never moved and nothing here is a posterior. The effective sample size estimator truncates its autocorrelation sum, which overstates for badly mixing chains: below about 30 it should not be trusted."
  }
 },
 "simulation": {
  "horizon_days": 30,
  "paths": 10000,
  "requested_paths": 10000,
  "antithetic": false,
  "fan": [
   {
    "day": 1,
    "p5": 97.6803813651458,
    "p25": 99.0743882522831,
    "p50": 100.02923715623803,
    "p75": 100.9735121392367,
    "p95": 102.44065129466105
   },
   {
    "day": 2,
    "p5": 96.77437801849197,
    "p25": 98.69523640858174,
    "p50": 100.0403005699566,
    "p75": 101.37884845144528,
    "p95": 103.48633849679753
   },
   {
    "day": 3,
    "p5": 96.11895696678344,
    "p25": 98.44939773578108,
    "p50": 100.07371818260054,
    "p75": 101.71298824313178,
    "p95": 104.31347457131928
   },
   {
    "day": 4,
    "p5": 95.58049939719305,
    "p25": 98.2529839069238,
    "p50": 100.09703716281868,
    "p75": 102.0359882407478,
    "p95": 104.93959572990408
   },
   {
    "day": 5,
    "p5": 95.01049704485699,
    "p25": 98.03400706670975,
    "p50": 100.16653423355996,
    "p75": 102.2845580159361,
    "p95": 105.58370910610988
   },
   {
    "day": 6,
    "p5": 94.57209562053363,
    "p25": 97.90901754646468,
    "p50": 100.18335630674858,
    "p75": 102.5565688612613,
    "p95": 106.22712304680277
   },
   {
    "day": 7,
    "p5": 94.18603798666223,
    "p25": 97.7250126471413,
    "p50": 100.24778129466283,
    "p75": 102.73532963185058,
    "p95": 106.80862772202653
   },
   {
    "day": 8,
    "p5": 93.7660993888375,
    "p25": 97.5988273767846,
    "p50": 100.26844232792068,
    "p75": 103.0081256978651,
    "p95": 107.29185673300897
   },
   {
    "day": 9,
    "p5": 93.58349714745341,
    "p25": 97.49054206790285,
    "p50": 100.30958751518901,
    "p75": 103.2393527243585,
    "p95": 107.78023245154807
   },
   {
    "day": 10,
    "p5": 93.2278548022945,
    "p25": 97.37072520309918,
    "p50": 100.32081119818366,
    "p75": 103.38451985671665,
    "p95": 108.1813656597001
   },
   {
    "day": 11,
    "p5": 92.93953373749376,
    "p25": 97.26469268750634,
    "p50": 100.32872123749858,
    "p75": 103.47680463381388,
    "p95": 108.5949123635359
   },
   {
    "day": 12,
    "p5": 92.59063597678097,
    "p25": 97.14262982528626,
    "p50": 100.393862307367,
    "p75": 103.69176215690509,
    "p95": 108.91521279794681
   },
   {
    "day": 13,
    "p5": 92.3420067398949,
    "p25": 97.00848975498414,
    "p50": 100.44850455009703,
    "p75": 103.85936722645143,
    "p95": 109.32130252254457
   },
   {
    "day": 14,
    "p5": 92.18321330900201,
    "p25": 96.90811373258857,
    "p50": 100.4179051451408,
    "p75": 104.04094863065933,
    "p95": 109.56118491693323
   },
   {
    "day": 15,
    "p5": 91.77339768469432,
    "p25": 96.83111936397138,
    "p50": 100.44260843952118,
    "p75": 104.32955961362396,
    "p95": 110.05110987492851
   },
   {
    "day": 16,
    "p5": 91.55571730440435,
    "p25": 96.78302870686001,
    "p50": 100.47018618693714,
    "p75": 104.45303064913942,
    "p95": 110.59928793469004
   },
   {
    "day": 17,
    "p5": 91.40978911289618,
    "p25": 96.75850342593948,
    "p50": 100.54780337439217,
    "p75": 104.63453470181358,
    "p95": 111.02465014111353
   },
   {
    "day": 18,
    "p5": 91.16535896742907,
    "p25": 96.69888414661696,
    "p50": 100.60754025446431,
    "p75": 104.76324201596806,
    "p95": 111.29430867482608
   },
   {
    "day": 19,
    "p5": 90.83402390392614,
    "p25": 96.6554625154426,
    "p50": 100.66827488556132,
    "p75": 104.97206611371973,
    "p95": 111.53625310374007
   },
   {
    "day": 20,
    "p5": 90.68066608761454,
    "p25": 96.50391638671687,
    "p50": 100.71560588456589,
    "p75": 105.20089223216038,
    "p95": 112.01490973090019
   },
   {
    "day": 21,
    "p5": 90.44968217671493,
    "p25": 96.43646654927593,
    "p50": 100.78957423487319,
    "p75": 105.27761474929281,
    "p95": 112.19452810255824
   },
   {
    "day": 22,
    "p5": 90.24578308430485,
    "p25": 96.38928689488671,
    "p50": 100.80210131296315,
    "p75": 105.50222872411278,
    "p95": 112.56113378421168
   },
   {
    "day": 23,
    "p5": 90.08816136216711,
    "p25": 96.30087281731625,
    "p50": 100.86559811665597,
    "p75": 105.7010528532401,
    "p95": 112.82654294467243
   },
   {
    "day": 24,
    "p5": 89.99709196799178,
    "p25": 96.32673441423401,
    "p50": 100.94480965201618,
    "p75": 105.84319825311931,
    "p95": 113.062522154309
   },
   {
    "day": 25,
    "p5": 89.68620259555449,
    "p25": 96.20666341382594,
    "p50": 100.94991546979887,
    "p75": 105.97255565987848,
    "p95": 113.33627152179427
   },
   {
    "day": 26,
    "p5": 89.47838701643781,
    "p25": 96.1325843450725,
    "p50": 101.02490509050784,
    "p75": 106.0902153364818,
    "p95": 113.6911371676912
   },
   {
    "day": 27,
    "p5": 89.33208340319509,
    "p25": 96.06454901335476,
    "p50": 101.08712958003993,
    "p75": 106.27926759225919,
    "p95": 114.0488659387297
   },
   {
    "day": 28,
    "p5": 89.25712296954478,
    "p25": 96.05256962126381,
    "p50": 101.08800360182322,
    "p75": 106.32616605595801,
    "p95": 114.24051690891146
   },
   {
    "day": 29,
    "p5": 88.82556847133404,
    "p25": 95.92997455826675,
    "p50": 101.15427760819227,
    "p75": 106.4752918531168,
    "p95": 114.50048622675473
   },
   {
    "day": 30,
    "p5": 88.7472168894272,
    "p25": 95.85133845805694,
    "p50": 101.17457320337581,
    "p75": 106.56041198724962,
    "p95": 114.72297882971652
   }
  ],
  "terminal_histogram": [
   {
    "lo": 71.50023531136411,
    "hi": 72.83286842643047,
    "count": 1
   },
   {
    "lo": 72.83286842643047,
    "hi": 74.16550154149684,
    "count": 0
   },
   {
    "lo": 74.16550154149684,
    "hi": 75.4981346565632,
    "count": 0
   },
   {
    "lo": 75.4981346565632,
    "hi": 76.83076777162957,
    "count": 1
   },
   {
    "lo": 76.83076777162957,
    "hi": 78.16340088669592,
    "count": 6
   },
   {
    "lo": 78.16340088669592,
    "hi": 79.4960340017623,
    "count": 10
   },
   {
    "lo": 79.4960340017623,
    "hi": 80.82866711682865,
    "count": 16
   },
   {
    "lo": 80.82866711682865,
    "hi": 82.16130023189503,
    "count": 20
   },
   {
    "lo": 82.16130023189503,
    "hi": 83.49393334696138,
    "count": 30
   },
   {
    "lo": 83.49393334696138,
    "hi": 84.82656646202776,
    "count": 50
   },
   {
    "lo": 84.82656646202776,
    "hi": 86.15919957709411,